{
  "$schema": "./page-api-fact-matrix.schema.json",
  "matrix_version": "shanhai.page-api-fact-matrix/v1",
  "state_model": [
    "not_started",
    "ready",
    "queued",
    "running",
    "provider_succeeded",
    "failed",
    "draft",
    "submitted",
    "quality_failed",
    "awaiting_approval",
    "approved",
    "adopted",
    "saved_to_project",
    "stale",
    "cancelled"
  ],
  "operations": [
    {"operation_id": "listProjects", "availability": "active", "formal_fact_role": "Project collection"},
    {"operation_id": "createProject", "availability": "active", "formal_fact_role": "Project creation"},
    {"operation_id": "getProject", "availability": "active", "formal_fact_role": "Project identity and fixed ContentRelease"},
    {"operation_id": "listProjectLessons", "availability": "active", "formal_fact_role": "Ordered LessonUnit collection"},
    {"operation_id": "getLesson", "availability": "active", "formal_fact_role": "LessonUnit identity and enabled branches"},
    {"operation_id": "createMaterialUploadSession", "availability": "active", "formal_fact_role": "Private material upload session"},
    {"operation_id": "confirmMaterialUpload", "availability": "active", "formal_fact_role": "SourceMaterial and parse job"},
    {"operation_id": "getSourceMaterialFileAsset", "availability": "active", "formal_fact_role": "Exact FileAssetVersion metadata"},
    {"operation_id": "listMaterialParseVersions", "availability": "active", "formal_fact_role": "MaterialParseVersion history"},
    {"operation_id": "prepareLessonDivision", "availability": "candidate_required", "formal_fact_role": "Exact approved material scope preparation", "promotion_requirement": "Must be added to active OpenAPI with runtime and contract tests before frontend integration"},
    {"operation_id": "getProjectWorkflow", "availability": "active", "formal_fact_role": "NodeRun and branch aggregate"},
    {"operation_id": "startNodeRun", "availability": "planned", "formal_fact_role": "NodeRun command producing GenerationJob", "promotion_requirement": "Must move from planned to active before production frontend calls it"},
    {"operation_id": "getPromptPreview", "availability": "active", "formal_fact_role": "Editable business prompt projection only"},
    {"operation_id": "getGenerationJob", "availability": "active", "formal_fact_role": "GenerationJob state from PostgreSQL"},
    {"operation_id": "streamGenerationJobEvents", "availability": "active", "formal_fact_role": "Job SSE with Last-Event-ID resume"},
    {"operation_id": "streamProjectEvents", "availability": "active", "formal_fact_role": "Project SSE with Last-Event-ID resume"},
    {"operation_id": "listProjectArtifacts", "availability": "candidate_required", "formal_fact_role": "Lesson-scoped Artifact collection and exact version pointers", "promotion_requirement": "Must be added to active OpenAPI with project and lesson filters before frontend integration"},
    {"operation_id": "getArtifact", "availability": "active", "formal_fact_role": "Artifact current draft and immutable version pointers"},
    {"operation_id": "saveArtifactDraft", "availability": "active", "formal_fact_role": "Optimistic-lock draft persistence"},
    {"operation_id": "submitArtifactVersion", "availability": "active", "formal_fact_role": "Immutable ArtifactVersion submission"},
    {"operation_id": "reviewArtifactVersion", "availability": "active", "formal_fact_role": "Approval append and pointer transition"},
    {"operation_id": "getLessonIntroOptions", "availability": "active", "formal_fact_role": "Approved option set, pending version and current IntroSelection"},
    {"operation_id": "selectLessonIntroOption", "availability": "active", "formal_fact_role": "Immutable exact IntroSelection"},
    {"operation_id": "createCreationPackage", "availability": "planned", "formal_fact_role": "Immutable node-to-creation package bridge", "promotion_requirement": "Must move from planned to active before project-source creation workflows use it"},
    {"operation_id": "createCreationBatch", "availability": "active", "formal_fact_role": "CreationBatch from immutable package or standalone source"},
    {"operation_id": "saveCreationPromptVersion", "availability": "active", "formal_fact_role": "Immutable editable business prompt version"},
    {"operation_id": "generateCreationItem", "availability": "active", "formal_fact_role": "GenerationJob from exact PromptVersion"},
    {"operation_id": "generateCreationBatch", "availability": "active", "formal_fact_role": "Batch GenerationJobs from exact PromptVersions"},
    {"operation_id": "adoptGenerationResult", "availability": "active", "formal_fact_role": "Adoption without project write"},
    {"operation_id": "saveAdoptionToProject", "availability": "active", "formal_fact_role": "Atomic adopted result write to fixed project slot"},
    {"operation_id": "listProjectAssetSlots", "availability": "active", "formal_fact_role": "Lesson-scoped project asset slots and bindings"},
    {"operation_id": "getProjectAssetPackage", "availability": "active", "formal_fact_role": "Project asset drawer aggregate"}
  ],
  "pages": [
    {
      "page_key": "projects",
      "route": "/app/projects",
      "scope_keys": ["project_id"],
      "actions": [
        {
          "action_key": "open_or_create_project",
          "operation_ids": ["listProjects", "createProject", "getProject"],
          "formal_facts": ["Project", "ContentRelease binding"],
          "exact_references": ["project_id", "content_release_id"],
          "completion_rule": "Project exists in PostgreSQL and returns its fixed release; navigation state alone is not completion."
        }
      ],
      "refresh_operations": ["getProject", "listProjectLessons", "getProjectWorkflow"]
    },
    {
      "page_key": "material",
      "route": "/app/projects/:projectId/materials/:materialId?",
      "scope_keys": ["project_id", "job_id"],
      "actions": [
        {
          "action_key": "upload_and_parse_material",
          "operation_ids": ["createMaterialUploadSession", "confirmMaterialUpload", "getGenerationJob", "streamGenerationJobEvents", "getSourceMaterialFileAsset", "listMaterialParseVersions"],
          "formal_facts": ["SourceMaterial", "FileAssetVersion", "MaterialParseVersion", "GenerationJob"],
          "exact_references": ["project_id", "source_material_id", "file_asset_version_id", "material_parse_version_id"],
          "completion_rule": "Upload confirmation starts a job; parse completion requires a persisted MaterialParseVersion and does not imply material-scope approval."
        },
        {
          "action_key": "approve_material_scope",
          "operation_ids": ["prepareLessonDivision", "getArtifact", "saveArtifactDraft", "submitArtifactVersion", "reviewArtifactVersion"],
          "formal_facts": ["material_scope ArtifactVersion", "Approval"],
          "exact_references": ["project_id", "source_material_id", "material_parse_version_id", "material_scope_artifact_version_id"],
          "completion_rule": "Only the exact approved material-scope version may enter lesson division."
        }
      ],
      "refresh_operations": ["getProject", "getSourceMaterialFileAsset", "listMaterialParseVersions", "getProjectWorkflow"]
    },
    {
      "page_key": "lesson_division",
      "route": "/app/projects/:projectId/lessons",
      "scope_keys": ["project_id", "node_run_id", "job_id", "artifact_id", "artifact_version_id"],
      "actions": [
        {
          "action_key": "generate_lesson_division",
          "operation_ids": ["getProjectWorkflow", "getPromptPreview", "startNodeRun", "getGenerationJob", "streamGenerationJobEvents", "listProjectArtifacts", "getArtifact"],
          "formal_facts": ["NodeRun", "GenerationJob", "lesson_division ArtifactVersion"],
          "exact_references": ["project_id", "material_scope_artifact_version_id", "material_parse_version_id", "node_run_id", "artifact_version_id"],
          "completion_rule": "Provider success is intermediate; the generated ArtifactVersion must be submitted, quality validated and approved."
        },
        {
          "action_key": "review_lesson_division",
          "operation_ids": ["saveArtifactDraft", "submitArtifactVersion", "reviewArtifactVersion", "listProjectLessons"],
          "formal_facts": ["ArtifactVersion", "ArtifactQualityReport", "Approval", "LessonUnit collection"],
          "exact_references": ["lesson_division_artifact_version_id", "quality_report_id", "approval_id"],
          "completion_rule": "LessonUnit sync occurs only from the exact approved lesson-division version."
        }
      ],
      "refresh_operations": ["getProjectWorkflow", "listProjectLessons", "listProjectArtifacts"]
    },
    {
      "page_key": "lesson_plan",
      "route": "/app/projects/:projectId/lessons/:lessonId/work/lesson-plan",
      "scope_keys": ["project_id", "lesson_id", "node_run_id", "job_id", "artifact_id", "artifact_version_id"],
      "actions": [
        {
          "action_key": "generate_and_approve_lesson_plan",
          "operation_ids": ["getLesson", "getProjectWorkflow", "getPromptPreview", "startNodeRun", "getGenerationJob", "streamGenerationJobEvents", "listProjectArtifacts", "getArtifact", "saveArtifactDraft", "submitArtifactVersion", "reviewArtifactVersion"],
          "formal_facts": ["LessonUnit", "NodeRun", "GenerationJob", "lesson_plan ArtifactVersion", "ArtifactQualityReport", "Approval"],
          "exact_references": ["project_id", "lesson_id", "approved_lesson_division_version_id", "material_parse_version_id", "lesson_plan_artifact_version_id", "approval_id"],
          "completion_rule": "PPT may start only from the exact approved lesson-plan ArtifactVersion for this lesson."
        }
      ],
      "refresh_operations": ["getLesson", "getProjectWorkflow", "listProjectArtifacts"]
    },
    {
      "page_key": "intro_options",